"","category","over_represented_pvalue","under_represented_pvalue","numDEInCat","numInCat","adjP","Pathway","DEgenesInCat"
"1635","R-HSA-3065679","1","0.6523","0","6","1","SUMO is proteolytically processed",""
"1636","R-HSA-193670","1","0.6523","0","6","1","p75NTR negatively regulates cell cycle via SC1",""
"1637","R-HSA-9018679","1","0.6523","0","6","1","Biosynthesis of EPA-derived SPMs",""
"1638","R-HSA-5221030","1","0.7522","0","4","1","TET1,2,3 and TDG demethylate DNA",""
"1639","R-HSA-6803544","1","0.7522","0","4","1","Ion influx efflux at host-pathogen interface",""
"1640","R-HSA-112313","1","0.7522","0","4","1","Neurotransmitter uptake and metabolism In glial cells",""
"1641","R-HSA-210455","1","0.7522","0","4","1","Astrocytic Glutamate-Glutamine Uptake And Metabolism",""
"1642","R-HSA-6798163","1","0.6523","0","6","1","Choline catabolism",""
"1643","R-HSA-5682294","1","0.9313","0","1","1","Defective ABCA12 causes autosomal recessive congenital ichthyosis type 4B",""
"1644","R-HSA-3560792","1","0.9313","0","1","1","Defective SLC26A2 causes chondrodysplasias",""
"1645","R-HSA-5467333","1","0.9313","0","1","1","APC truncation mutants are not K63 polyubiquitinated",""
"1646","R-HSA-5619039","1","0.9313","0","1","1","Defective SLC12A6 causes agenesis of the corpus callosum, with peripheral neuropathy (ACCPN)",""
"1647","R-HSA-70370","1","0.7005","0","5","1","Galactose catabolism",""
"1648","R-HSA-1296061","1","0.7522","0","4","1","HCN channels",""
"1649","R-HSA-5678420","1","0.8673","0","2","1","Defective ABCC9 causes dilated cardiomyopathy 10, familial atrial fibrillation 12 and hypertrichotic osteochondrodysplasia",""
"1650","R-HSA-187015","1","0.6523","0","6","1","Activation of TRKA receptors",""
"1651","R-HSA-5683177","1","0.8673","0","2","1","Defective ABCC8 can cause hypoglycemias and hyperglycemias",""
"1652","R-HSA-5683371","1","0.9313","0","1","1","Defective ABCB6 causes isolated colobomatous microphthalmia 7 (MCOPCB7)",""
"1653","R-HSA-2033515","1","0.9313","0","1","1","t(4;14) translocations of FGFR3",""
"1654","R-HSA-2206285","1","0.9313","0","1","1","MPS VI - Maroteaux-Lamy syndrome",""
"1655","R-HSA-3359471","1","0.9313","0","1","1","Defective MMAB causes methylmalonic aciduria type cblB",""
"1656","R-HSA-4549380","1","0.9313","0","1","1","Defective ALG1 causes ALG1-CDG (CDG-1k)",""
"1657","R-HSA-5579012","1","0.9313","0","1","1","Defective MAOA causes Brunner syndrome (BRUNS)",""
"1658","R-HSA-5619048","1","0.9313","0","1","1","Defective SLC11A2 causes hypochromic microcytic anemia, with iron overload 1 (AHMIO1)",""
"1659","R-HSA-5619062","1","0.9313","0","1","1","Defective SLC1A3 causes episodic ataxia 6 (EA6)",""
"1660","R-HSA-5619068","1","0.9313","0","1","1","Defective SLC2A10 causes arterial tortuosity syndrome (ATS)",""
"1661","R-HSA-3560796","1","0.9313","0","1","1","Defective PAPSS2 causes SEMD-PA",""
"1662","R-HSA-5619076","1","0.9313","0","1","1","Defective SLC17A8 causes autosomal dominant deafness 25 (DFNA25)",""
"1663","R-HSA-5678771","1","0.9313","0","1","1","Defective ABCB4 causes progressive familial intrahepatic cholestasis 3, intrahepatic cholestasis of pregnancy 3 and gallbladder disease 1",""
"1664","R-HSA-211957","1","0.9313","0","1","1","Aromatic amines can be N-hydroxylated or N-dealkylated by CYP1A2",""
"1665","R-HSA-1483076","1","0.9313","0","1","1","Synthesis of CL",""
"1666","R-HSA-5263617","1","0.9313","0","1","1","Metabolism of ingested MeSeO2H into MeSeH",""
"1667","R-HSA-5619043","1","0.9313","0","1","1","Defective SLC2A1 causes GLUT1 deficiency syndrome 1 (GLUT1DS1)",""
"1668","R-HSA-5619046","1","0.9313","0","1","1","Defective SLC26A4 causes Pendred syndrome (PDS)",""
"1669","R-HSA-5619056","1","0.9313","0","1","1","Defective HK1 causes hexokinase deficiency (HK deficiency)",""
"1670","R-HSA-5619067","1","0.9313","0","1","1","Defective SLC1A1 is implicated in schizophrenia 18 (SCZD18) and dicarboxylic aminoaciduria (DCBXA)",""
"1671","R-HSA-5619096","1","0.9313","0","1","1","Defective SLC5A5 causes thyroid dyshormonogenesis 1 (TDH1)",""
"1672","R-HSA-5619104","1","0.9313","0","1","1","Defective SLC12A1 causes Bartter syndrome 1 (BS1)",""
"1673","R-HSA-5619111","1","0.9313","0","1","1","Defective SLC20A2 causes idiopathic basal ganglia calcification 1 (IBGC1)",""
"1674","R-HSA-4724289","1","0.9313","0","1","1","Defective ALG6 causes ALG6-CDG (CDG-1c)",""
"1675","R-HSA-5579017","1","0.9313","0","1","1","Defective CYP11B1 causes Adrenal hyperplasia 4 (AH4)",""
"1676","R-HSA-5579024","1","0.9313","0","1","1","Defective MAT1A causes Methionine adenosyltransferase deficiency (MATD)",""
"1677","R-HSA-5619041","1","0.9313","0","1","1","Defective SLC36A2 causes iminoglycinuria (IG) and hyperglycinuria (HG)",""
"1678","R-HSA-5619053","1","0.9313","0","1","1","Defective SLC22A5 causes systemic primary carnitine deficiency (CDSP)",""
"1679","R-HSA-5619078","1","0.9313","0","1","1","Defective SLC35C1 causes congenital disorder of glycosylation 2C (CDG2C)",""
"1680","R-HSA-5619098","1","0.9313","0","1","1","Defective SLC2A2 causes Fanconi-Bickel syndrome (FBS)",""
"1681","R-HSA-5619109","1","0.9313","0","1","1","Defective SLC6A2 causes orthostatic intolerance (OI)",""
"1682","R-HSA-5678520","1","0.9313","0","1","1","Defective ABCB11 causes progressive familial intrahepatic cholestasis 2 and benign recurrent intrahepatic cholestasis 2",""
"1683","R-HSA-1251932","1","0.7522","0","4","1","PLCG1 events in ERBB2 signaling",""
"1684","R-HSA-9018676","1","0.7522","0","4","1","Biosynthesis of D-series resolvins",""
"1685","R-HSA-111957","1","0.6523","0","6","1","Cam-PDE 1 activation",""
"1686","R-HSA-9027307","1","0.6523","0","6","1","Biosynthesis of maresin-like SPMs",""
"1687","R-HSA-5579010","1","0.9313","0","1","1","Defective CYP24A1 causes Hypercalcemia, infantile (HCAI)",""
"1688","R-HSA-3274531","1","0.9313","0","1","1","Glycogen storage disease type Ia (G6PC)",""
"1689","R-HSA-2473224","1","0.7522","0","4","1","Antagonism of Activin by Follistatin",""
"1690","R-HSA-8853383","1","0.7522","0","4","1","Lysosomal oligosaccharide catabolism",""
"1691","R-HSA-8941237","1","0.7522","0","4","1","Invadopodia formation",""
"1692","R-HSA-211736","1","0.8673","0","2","1","Stimulation of the cell death response by PAK-2p34",""
"1693","R-HSA-5602680","1","0.8673","0","2","1","MyD88 deficiency (TLR5)",""
"1694","R-HSA-71737","1","0.8673","0","2","1","Pyrophosphate hydrolysis",""
"1695","R-HSA-5579002","1","0.9313","0","1","1","Defective UGT1A1 causes hyperbilirubinemia",""
"1696","R-HSA-1299361","1","0.8673","0","2","1","TWIK-related alkaline pH activated K+ channel (TALK)",""
"1697","R-HSA-5662702","1","0.7005","0","5","1","Melanin biosynthesis",""
"1698","R-HSA-6783984","1","0.7522","0","4","1","Glycine degradation",""
"1699","R-HSA-110362","1","0.5268","0","9","1","POLB-Dependent Long Patch Base Excision Repair",""
"1700","R-HSA-110373","1","0.1567","0","26","1","Resolution of AP sites via the multiple-nucleotide patch replacement pathway",""
"1701","R-HSA-111453","1","0.5268","0","9","1","BH3-only proteins associate with and inactivate anti-apoptotic BCL-2 members",""
"1702","R-HSA-111458","1","0.4568","0","11","1","Formation of apoptosome",""
"1703","R-HSA-111461","1","0.3961","0","13","1","Cytochrome c-mediated apoptotic response",""
"1704","R-HSA-111463","1","0.6075","0","7","1","SMAC (DIABLO) binds to IAPs ",""
"1705","R-HSA-111464","1","0.6075","0","7","1","SMAC(DIABLO)-mediated dissociation of IAP-caspase complexes ",""
"1706","R-HSA-111465","1","0.0665","0","38","1","Apoptotic cleavage of cellular proteins",""
"1707","R-HSA-111469","1","0.5657","0","8","1","SMAC, XIAP-regulated apoptotic response",""
"1708","R-HSA-111932","1","0.4254","0","12","1","CaMK IV-mediated phosphorylation of CREB",""
"1709","R-HSA-112311","1","0.4906","0","10","1","Neurotransmitter clearance",""
"1710","R-HSA-113507","1","0.5268","0","9","1","E2F-enabled inhibition of pre-replication complex formation",""
"1711","R-HSA-114604","1","0.0885","0","34","1","GPVI-mediated activation cascade",""
"1712","R-HSA-1170546","1","0.3435","0","15","1","Prolactin receptor signaling",""
"1713","R-HSA-1222556","1","0.0767","0","36","1","ROS and RNS production in phagocytes",""
"1714","R-HSA-1236973","1","0.5657","0","8","1","Cross-presentation of particulate exogenous antigens (phagosomes)",""
"1715","R-HSA-1236977","1","0.4568","0","11","1","Endosomal Vacuolar pathway",""
"1716","R-HSA-1296346","1","0.4254","0","12","1","Tandem pore domain potassium channels",""
"1717","R-HSA-1362300","1","0.3199","0","16","1","Transcription of E2F targets under negative control by p107 (RBL1) and p130 (RBL2) in complex with HDAC1",""
"1718","R-HSA-1362409","1","0.3961","0","13","1","Mitochondrial iron-sulfur cluster biogenesis",""
"1719","R-HSA-139853","1","0.3435","0","15","1","Elevation of cytosolic Ca2+ levels",""
"1720","R-HSA-139915","1","0.5268","0","9","1","Activation of PUMA and translocation to mitochondria",""
"1721","R-HSA-1433617","1","0.4568","0","11","1","Regulation of signaling by NODAL",""
"1722","R-HSA-1474151","1","0.4254","0","12","1","Tetrahydrobiopterin (BH4) synthesis, recycling, salvage and regulation",""
"1723","R-HSA-1482883","1","0.6075","0","7","1","Acyl chain remodeling of DAG and TAG",""
"1724","R-HSA-1483148","1","0.5657","0","8","1","Synthesis of PG",""
"1725","R-HSA-1483213","1","0.3961","0","13","1","Synthesis of PE",""
"1726","R-HSA-1502540","1","0.3961","0","13","1","Signaling by Activin",""
"1727","R-HSA-156581","1","0.3689","0","14","1","Methylation",""
"1728","R-HSA-156587","1","0.5268","0","9","1","Amino Acid conjugation",""
"1729","R-HSA-159418","1","0.3199","0","16","1","Recycling of bile acids and salts",""
"1730","R-HSA-159424","1","0.5268","0","9","1","Conjugation of carboxylic acids",""
"1731","R-HSA-159740","1","0.4906","0","10","1","Gamma-carboxylation of protein precursors",""
"1732","R-HSA-159763","1","0.5268","0","9","1","Transport of gamma-carboxylated protein precursors from the endoplasmic reticulum to the Golgi apparatus",""
"1733","R-HSA-162658","1","0.3689","0","14","1","Golgi Cisternae Pericentriolar Stack Reorganization",""
"1734","R-HSA-162710","1","0.3199","0","16","1","Synthesis of glycosylphosphatidylinositol (GPI)",""
"1735","R-HSA-162791","1","0.6075","0","7","1","Attachment of GPI anchor to uPAR",""
"1736","R-HSA-163680","1","0.5657","0","8","1","AMPK inhibits chREBP transcriptional activation activity",""
"1737","R-HSA-163765","1","0.6075","0","7","1","ChREBP activates metabolic gene expression",""
"1738","R-HSA-164944","1","0.5657","0","8","1","Nef and signal transduction",""
"1739","R-HSA-1660514","1","0.2978","0","17","1","Synthesis of PIPs at the Golgi membrane",""
"1740","R-HSA-166665","1","0.5657","0","8","1","Terminal pathway of complement",""
"1741","R-HSA-170660","1","0.4906","0","10","1","Adenylate cyclase activating pathway",""
"1742","R-HSA-170670","1","0.3689","0","14","1","Adenylate cyclase inhibitory pathway",""
"1743","R-HSA-170968","1","0.4254","0","12","1","Frs2-mediated activation",""
"1744","R-HSA-174414","1","0.4568","0","11","1","Processive synthesis on the C-strand of the telomere",""
"1745","R-HSA-174437","1","0.4906","0","10","1","Removal of the Flap Intermediate from the C-strand",""
"1746","R-HSA-174577","1","0.6075","0","7","1","Activation of C3 and C5",""
"1747","R-HSA-177128","1","0.5657","0","8","1","Conjugation of salicylate with glycine",""
"1748","R-HSA-177504","1","0.3689","0","14","1","Retrograde neurotrophin signalling",""
"1749","R-HSA-181431","1","0.3435","0","15","1","Acetylcholine binding and downstream events",""
"1750","R-HSA-182218","1","0.6075","0","7","1","Nef Mediated CD8 Down-regulation",""
"1751","R-HSA-1834941","1","0.3199","0","16","1","STING mediated induction of host immune responses",""
"1752","R-HSA-1855167","1","0.4906","0","10","1","Synthesis of pyrophosphates in the cytosol",""
"1753","R-HSA-189451","1","0.4568","0","11","1","Heme biosynthesis",""
"1754","R-HSA-190377","1","0.4906","0","10","1","FGFR2b ligand binding and activation",""
"1755","R-HSA-190873","1","0.4254","0","12","1","Gap junction degradation",""
"1756","R-HSA-193368","1","0.1808","0","24","1","Synthesis of bile acids and bile salts via 7alpha-hydroxycholesterol",""
"1757","R-HSA-193692","1","0.4568","0","11","1","Regulated proteolysis of p75NTR",""
"1758","R-HSA-193775","1","0.3689","0","14","1","Synthesis of bile acids and bile salts via 24-hydroxycholesterol",""
"1759","R-HSA-193807","1","0.3435","0","15","1","Synthesis of bile acids and bile salts via 27-hydroxycholesterol",""
"1760","R-HSA-194002","1","0.4906","0","10","1","Glucocorticoid biosynthesis",""
"1761","R-HSA-194313","1","0.5657","0","8","1","VEGF ligand-receptor interactions",""
"1762","R-HSA-195399","1","0.5657","0","8","1","VEGF binds to VEGFR leading to receptor dimerization",""
"1763","R-HSA-196025","1","0.4568","0","11","1","Formation of annular gap junctions",""
"1764","R-HSA-196783","1","0.5657","0","8","1","Coenzyme A biosynthesis",""
"1765","R-HSA-196791","1","0.4568","0","11","1","Vitamin D (calciferol) metabolism",""
"1766","R-HSA-196843","1","0.6075","0","7","1","Vitamin B2 (riboflavin) metabolism",""
"1767","R-HSA-198203","1","0.5268","0","9","1","PI3K AKT activation",""
"1768","R-HSA-198323","1","0.3689","0","14","1","AKT phosphorylates targets in the cytosol",""
"1769","R-HSA-199220","1","0.2978","0","17","1","Vitamin B5 (pantothenate) metabolism",""
"1770","R-HSA-199920","1","0.6075","0","7","1","CREB phosphorylation",""
"1771","R-HSA-200425","1","0.3961","0","13","1","Import of palmitoyl-CoA into the mitochondrial matrix",""
"1772","R-HSA-201688","1","0.5657","0","8","1","WNT mediated activation of DVL",""
"1773","R-HSA-2022377","1","0.2773","0","18","1","Metabolism of Angiotensinogen to Angiotensins",""
"1774","R-HSA-2022870","1","0.2405","0","20","1","Chondroitin sulfate biosynthesis",""
"1775","R-HSA-2022923","1","0.4568","0","11","1","Dermatan sulfate biosynthesis",""
"1776","R-HSA-2024096","1","0.2085","0","22","1","HS-GAG degradation",""
"1777","R-HSA-2029481","1","0.4254","0","12","1","FCGR activation",""
"1778","R-HSA-2032785","1","0.3435","0","15","1","YAP1- and WWTR1 (TAZ)-stimulated gene expression",""
"1779","R-HSA-203615","1","0.3961","0","13","1","eNOS activation",""
"1780","R-HSA-2046105","1","0.5657","0","8","1","Linoleic acid (LA) metabolism",""
"1781","R-HSA-209776","1","0.2773","0","18","1","Metabolism of amine-derived hormones",""
"1782","R-HSA-209968","1","0.4906","0","10","1","Thyroxine biosynthesis",""
"1783","R-HSA-210744","1","0.3435","0","15","1","Regulation of gene expression in late stage (branching morphogenesis) pancreatic bud precursor cells",""
"1784","R-HSA-210990","1","0.4568","0","11","1","PECAM1 interactions",""
"1785","R-HSA-212718","1","0.5268","0","9","1","EGFR interacts with phospholipase C-gamma",""
"1786","R-HSA-2142688","1","0.5657","0","8","1","Synthesis of 5-eicosatetraenoic acids",""
"1787","R-HSA-2142712","1","0.6075","0","7","1","Synthesis of 12-eicosatetraenoic acid derivatives",""
"1788","R-HSA-2142789","1","0.6075","0","7","1","Ubiquinol biosynthesis",""
"1789","R-HSA-2197563","1","0.4254","0","12","1","NOTCH2 intracellular domain regulates transcription",""
"1790","R-HSA-2408508","1","0.5657","0","8","1","Metabolism of ingested SeMet, Sec, MeSec into H2Se",""
"1791","R-HSA-2468052","1","0.4568","0","11","1","Establishment of Sister Chromatid Cohesion",""
"1792","R-HSA-2485179","1","0.4568","0","11","1","Activation of the phototransduction cascade",""
"1793","R-HSA-2534343","1","0.4568","0","11","1","Interaction With Cumulus Cells And The Zona Pellucida",""
"1794","R-HSA-2586552","1","0.4568","0","11","1","Signaling by Leptin",""
"1795","R-HSA-264870","1","0.4254","0","12","1","Caspase-mediated cleavage of cytoskeletal proteins",""
"1796","R-HSA-2660825","1","0.6075","0","7","1","Signaling by NOTCH1 t(7;9)(NOTCH1-M1580_K2555) Translocation Mutant",""
"1797","R-HSA-2660826","1","0.6075","0","7","1","Constitutive Signaling by NOTCH1 t(7;9)(NOTCH1-M1580_K2555) Translocation Mutant",""
"1798","R-HSA-2980767","1","0.6075","0","7","1","Activation of NIMA Kinases NEK9, NEK6, NEK7",""
"1799","R-HSA-3065678","1","0.6075","0","7","1","SUMO is transferred from E1 to E2 (UBE2I, UBC9)",""
"1800","R-HSA-3215018","1","0.4906","0","10","1","Processing and activation of SUMO",""
"1801","R-HSA-3232118","1","0.2405","0","20","1","SUMOylation of transcription factors",""
"1802","R-HSA-3270619","1","0.3961","0","13","1","IRF3-mediated induction of type I IFN",""
"1803","R-HSA-3304349","1","0.6075","0","7","1","Loss of Function of SMAD2 3 in Cancer",""
"1804","R-HSA-3304351","1","0.5657","0","8","1","Signaling by TGF-beta Receptor Complex in Cancer",""
"1805","R-HSA-3371511","1","0.4254","0","12","1","HSF1 activation",""
"1806","R-HSA-351906","1","0.4568","0","11","1","Apoptotic cleavage of cell adhesion  proteins",""
"1807","R-HSA-3560783","1","0.2405","0","20","1","Defective B4GALT7 causes EDS, progeroid type",""
"1808","R-HSA-3560801","1","0.2405","0","20","1","Defective B3GAT3 causes JDSSDHD",""
"1809","R-HSA-3595172","1","0.5657","0","8","1","Defective CHST3 causes SEDCJD",""
"1810","R-HSA-3595174","1","0.5657","0","8","1","Defective CHST14 causes EDS, musculocontractural type",""
"1811","R-HSA-3595177","1","0.5657","0","8","1","Defective CHSY1 causes TPBS",""
"1812","R-HSA-3656237","1","0.3689","0","14","1","Defective EXT2 causes exostoses 2",""
"1813","R-HSA-3656253","1","0.3689","0","14","1","Defective EXT1 causes exostoses 1, TRPS2 and CHDS",""
"1814","R-HSA-3656534","1","0.6075","0","7","1","Loss of Function of TGFBR1 in Cancer",""
"1815","R-HSA-3772470","1","0.3435","0","15","1","Negative regulation of TCF-dependent signaling by WNT ligand antagonists",""
"1816","R-HSA-3781860","1","0.2978","0","17","1","Diseases associated with N-glycosylation of proteins",""
"1817","R-HSA-389357","1","0.2085","0","22","1","CD28 dependent PI3K Akt signaling",""
"1818","R-HSA-389957","1","0.1359","0","28","1","Prefoldin mediated transfer of substrate  to CCT TriC",""
"1819","R-HSA-390450","1","0.4906","0","10","1","Folding of actin by CCT TriC",""
"1820","R-HSA-391908","1","0.5268","0","9","1","Prostanoid ligand receptors",""
"1821","R-HSA-399954","1","0.3199","0","16","1","Sema3A PAK dependent Axon repulsion",""
"1822","R-HSA-399955","1","0.3689","0","14","1","SEMA3A-Plexin repulsion signaling by inhibiting Integrin adhesion",""
"1823","R-HSA-416550","1","0.5657","0","8","1","Sema4D mediated inhibition of cell attachment and migration",""
"1824","R-HSA-417957","1","0.4254","0","12","1","P2Y receptors",""
"1825","R-HSA-418038","1","0.3435","0","15","1","Nucleotide-like (purinergic) receptors",""
"1826","R-HSA-418359","1","0.3689","0","14","1","Reduction of cytosolic Ca++ levels",""
"1827","R-HSA-418360","1","0.1265","0","29","1","Platelet calcium homeostasis",""
"1828","R-HSA-418886","1","0.5657","0","8","1","Netrin mediated repulsion signals",""
"1829","R-HSA-418889","1","0.4906","0","10","1","Caspase activation via Dependence Receptors in the absence of ligand",""
"1830","R-HSA-418890","1","0.4906","0","10","1","Role of second messengers in netrin-1 signaling",""
"1831","R-HSA-419037","1","0.05","0","42","1","NCAM1 interactions",""
"1832","R-HSA-419408","1","0.3689","0","14","1","Lysosphingolipid and LPA receptors",""
"1833","R-HSA-419812","1","0.4906","0","10","1","Calcitonin-like ligand receptors",""
"1834","R-HSA-420597","1","0.6075","0","7","1","Nectin Necl  trans heterodimerization",""
"1835","R-HSA-425561","1","0.3961","0","13","1","Sodium Calcium exchangers",""
"1836","R-HSA-425986","1","0.5268","0","9","1","Sodium Proton exchangers",""
"1837","R-HSA-426117","1","0.6075","0","7","1","Cation-coupled Chloride cotransporters",""
"1838","R-HSA-427601","1","0.5268","0","9","1","Multifunctional anion exchangers",""
"1839","R-HSA-428540","1","0.3961","0","13","1","Activation of RAC1",""
"1840","R-HSA-428542","1","0.4906","0","10","1","Regulation of commissural axon pathfinding by SLIT and ROBO",""
"1841","R-HSA-428543","1","0.6075","0","7","1","Inactivation of CDC42 and RAC1",""
"1842","R-HSA-428643","1","0.4906","0","10","1","Organic anion transporters",""
"1843","R-HSA-428890","1","0.5657","0","8","1","Role of ABL in ROBO-SLIT signaling",""
"1844","R-HSA-4411364","1","0.5657","0","8","1","Binding of TCF LEF-CTNNB1 to target gene promoters",""
"1845","R-HSA-4419969","1","0.3435","0","15","1","Depolymerisation of the Nuclear Lamina",""
"1846","R-HSA-4420332","1","0.2405","0","20","1","Defective B3GALT6 causes EDSP2 and SEMDJL1",""
"1847","R-HSA-442380","1","0.4906","0","10","1","Zinc influx into cells by the SLC39 gene family",""
"1848","R-HSA-442729","1","0.4906","0","10","1","CREB1 phosphorylation through the activation of CaMKII CaMKK CaMKIV cascasde",""
"1849","R-HSA-442742","1","0.1265","0","29","1","CREB1 phosphorylation through NMDA receptor-mediated activation of RAS signaling",""
"1850","R-HSA-442982","1","0.2239","0","21","1","Ras activation upon Ca2+ influx through NMDA receptor",""
"1851","R-HSA-444257","1","0.6075","0","7","1","RSK activation",""
"1852","R-HSA-444821","1","0.6075","0","7","1","Relaxin receptors",""
"1853","R-HSA-445144","1","0.2239","0","21","1","Signal transduction by L1",""
"1854","R-HSA-446107","1","0.4568","0","11","1","Type I hemidesmosome assembly",""
"1855","R-HSA-446210","1","0.5657","0","8","1","Synthesis of UDP-N-acetyl-glucosamine",""
"1856","R-HSA-447038","1","0.6075","0","7","1","NrCAM interactions",""
"1857","R-HSA-447041","1","0.5268","0","9","1","CHL1 interactions",""
"1858","R-HSA-450520","1","0.5657","0","8","1","HuR (ELAVL1) binds and stabilizes mRNA",""
"1859","R-HSA-451306","1","0.4254","0","12","1","Ionotropic activity of kainate receptors",""
"1860","R-HSA-451308","1","0.4254","0","12","1","Activation of Ca-permeable Kainate Receptor",""
"1861","R-HSA-5083635","1","0.0767","0","36","1","Defective B3GALTL causes Peters-plus syndrome (PpS)",""
"1862","R-HSA-5099900","1","0.3435","0","15","1","WNT5A-dependent internalization of FZD4",""
"1863","R-HSA-5140745","1","0.3961","0","13","1","WNT5A-dependent internalization of FZD2, FZD5 and ROR2",""
"1864","R-HSA-5173214","1","0.0715","0","37","1","O-glycosylation of TSR domain-containing proteins",""
"1865","R-HSA-5218921","1","0.2239","0","21","1","VEGFR2 mediated cell proliferation",""
"1866","R-HSA-5340588","1","0.5657","0","8","1","RNF mutants show enhanced WNT signaling and proliferation",""
"1867","R-HSA-5357786","1","0.4254","0","12","1","TNFR1-induced proapoptotic signaling",""
"1868","R-HSA-5362798","1","0.5657","0","8","1","Release of Hh-Np from the secreting cell",""
"1869","R-HSA-5365859","1","0.2085","0","22","1","RA biosynthesis pathway",""
"1870","R-HSA-5423646","1","0.2583","0","19","1","Aflatoxin activation and detoxification",""
"1871","R-HSA-549127","1","0.5268","0","9","1","Organic cation transport",""
"1872","R-HSA-549132","1","0.3689","0","14","1","Organic cation anion zwitterion transport",""
"1873","R-HSA-5576886","1","0.2583","0","19","1","Phase 4 - resting membrane potential",""
"1874","R-HSA-5576894","1","0.6075","0","7","1","Phase 1 - inactivation of fast Na+ channels",""
"1875","R-HSA-5578768","1","0.4254","0","12","1","Physiological factors",""
"1876","R-HSA-5609975","1","0.2773","0","18","1","Diseases associated with glycosylation precursor biosynthesis",""
"1877","R-HSA-5638302","1","0.5657","0","8","1","Signaling by Overexpressed Wild-Type EGFR in Cancer",""
"1878","R-HSA-5638303","1","0.5657","0","8","1","Inhibition of Signaling by Overexpressed EGFR",""
"1879","R-HSA-5649702","1","0.6075","0","7","1","APEX1-Independent Resolution of AP Sites via the Single Nucleotide Replacement Pathway",""
"1880","R-HSA-5651801","1","0.2239","0","21","1","PCNA-Dependent Long Patch Base Excision Repair",""
"1881","R-HSA-5666185","1","0.5268","0","9","1","RHO GTPases Activate Rhotekin and Rhophilins",""
"1882","R-HSA-5669034","1","0.1265","0","29","1","TNFs bind their physiological receptors",""
"1883","R-HSA-5682910","1","0.3689","0","14","1","LGI-ADAM interactions",""
"1884","R-HSA-5685939","1","0.4906","0","10","1","HDR through MMEJ (alt-NHEJ)",""
"1885","R-HSA-622323","1","0.4254","0","12","1","Presynaptic nicotinic acetylcholine receptors",""
"1886","R-HSA-622327","1","0.3435","0","15","1","Postsynaptic nicotinic acetylcholine receptors",""
"1887","R-HSA-629587","1","0.6075","0","7","1","Highly sodium permeable acetylcholine nicotinic receptors",""
"1888","R-HSA-629594","1","0.4254","0","12","1","Highly calcium permeable postsynaptic nicotinic acetylcholine receptors",""
"1889","R-HSA-629597","1","0.5268","0","9","1","Highly calcium permeable nicotinic acetylcholine receptors",""
"1890","R-HSA-6787450","1","0.5268","0","9","1","tRNA modification in the mitochondrion",""
"1891","R-HSA-6803204","1","0.2405","0","20","1","TP53 Regulates Transcription of Genes Involved in Cytochrome C Release",""
"1892","R-HSA-6803207","1","0.4254","0","12","1","TP53 Regulates Transcription of Caspase Activators and Caspases",""
"1893","R-HSA-6803211","1","0.4254","0","12","1","TP53 Regulates Transcription of Death Receptors and Ligands",""
"1894","R-HSA-6804114","1","0.2773","0","18","1","TP53 Regulates Transcription of Genes Involved in G2 Cell Cycle Arrest",""
"1895","R-HSA-6804116","1","0.3689","0","14","1","TP53 Regulates Transcription of Genes Involved in G1 Cell Cycle Arrest",""
"1896","R-HSA-6804759","1","0.3689","0","14","1","Regulation of TP53 Activity through Association with Co-factors",""
"1897","R-HSA-70221","1","0.2978","0","17","1","Glycogen breakdown (glycogenolysis)",""
"1898","R-HSA-70263","1","0.0951","0","33","1","Gluconeogenesis",""
"1899","R-HSA-71240","1","0.3689","0","14","1","Tryptophan catabolism",""
"1900","R-HSA-72731","1","0.5657","0","8","1","Recycling of eIF2-GDP",""
"1901","R-HSA-73614","1","0.4568","0","11","1","Pyrimidine salvage",""
