"","category","over_represented_pvalue","under_represented_pvalue","numDEInCat","numInCat","adjP","Pathway","DEgenesInCat"
"973","R-HSA-442720","0.6311","0.7504","1","14","1","CREB1 phosphorylation through the activation of Adenylate Cyclase","PRKACG"
"974","R-HSA-9027284","0.6311","0.7504","1","14","1","Erythropoietin activates RAS","GRB2"
"975","R-HSA-180336","0.6311","0.7504","1","14","1","SHC1 events in EGFR signaling","GRB2"
"976","R-HSA-2024101","0.6311","0.7504","1","14","1","CS DS degradation","HYAL1"
"977","R-HSA-975110","0.6311","0.7504","1","14","1","TRAF6 mediated IRF7 activation in TLR7 8 or 9 signaling","UBB"
"978","R-HSA-844456","0.6311","0.7504","1","14","1","The NLRP3 inflammasome","NFKB2"
"979","R-HSA-3296469","0.6311","0.7504","1","14","1","Defects in cobalamin (B12) metabolism","CD320"
"980","R-HSA-6803205","0.6311","0.7504","1","14","1","TP53 regulates transcription of several additional cell death genes whose specific roles in p53-dependent apoptosis remain uncertain","PERP"
"981","R-HSA-169893","0.6311","0.7504","1","14","1","Prolonged ERK activation events","CRK"
"982","R-HSA-5358606","0.6311","0.7504","1","14","1","Mismatch repair (MMR) directed by MSH2-MSH3 (MutSbeta)","EXO1"
"983","R-HSA-5358565","0.6311","0.7504","1","14","1","Mismatch repair (MMR) directed by MSH2-MSH6 (MutSalpha)","EXO1"
"984","R-HSA-69166","0.6311","0.7504","1","14","1","Removal of the Flap Intermediate","POLA2"
"985","R-HSA-174411","0.6311","0.7504","1","14","1","Polymerase switching on the C-strand of the telomere","POLA2"
"986","R-HSA-69091","0.6311","0.7504","1","14","1","Polymerase switching","POLA2"
"987","R-HSA-69109","0.6311","0.7504","1","14","1","Leading Strand Synthesis","POLA2"
"988","R-HSA-174490","0.6311","0.7504","1","14","1","Membrane binding and targetting of GAG proteins","UBB"
"989","R-HSA-174495","0.6311","0.7504","1","14","1","Synthesis And Processing Of GAG, GAGPOL Polyproteins","UBB"
"990","R-HSA-190322","0.6311","0.7504","1","14","1","FGFR4 ligand binding and activation","FGF17"
"991","R-HSA-209952","0.6311","0.7504","1","14","1","Peptide hormone biosynthesis","LHB"
"992","R-HSA-5660526","0.6311","0.7504","1","14","1","Response to metal ions","MT4"
"993","R-HSA-5673001","0.6346","0.466","16","247","1","RAF MAP kinase cascade","RANBP9::CSF2RB::NRG4::RASA3::GRB2::JAK1::SPRED3::MARK3::PDGFRA::PPP2CA::PPP2R1A::PPP5C::PSMD4::TEK::UBB::FGF17"
"994","R-HSA-8951664","0.6356","0.4682","15","232","1","Neddylation","FEM1B::FBXL14::COMMD7::DCAF4::WSB1::FBXL22::NUB1::DCUN1D1::DCUN1D2::PSMD4::FBXW4::UBB::DDA1::KLHL22::SPSB4"
"995","R-HSA-9020591","0.6358","0.5941","3","47","1","Interleukin-12 signaling","HNRNPF::JAK1::MTAP"
"996","R-HSA-4608870","0.6372","0.5625","4","63","1","Asymmetric localization of PCP proteins","PARD6A::PSMD4::VANGL2::UBB"
"997","R-HSA-157118","0.6382","0.473","13","202","1","Signaling by NOTCH","TNRC6B::HEY1::NOTCH4::FURIN::PSMD4::TNRC6C::TBL1X::TLE4::UBB::YWHAZ::H2AC18::H3C12::NUMB"
"998","R-HSA-372790","0.6385","0.4096","75","1127","1","Signaling by GPCR","CDK5::OR52M1::OR2D2::LTB4R::OR9A4::TAAR1::ADRA1A::PLB1::DRD2::F2R::OR5D14::OR5AS1::OR10G8::OR4D5::METAP1::ARHGEF9::ARHGEF12::FPR3::OR2L2::OR8G2P::OR4F4::OR4D1::OR2H1::ARHGEF16::GNG5::GNG7::GRB2::GRM7::CXCL2::HCRTR1::HRH1::HTR1F::HTR5A::QRFP::OR52A5::OR51M1::OR52N5::OR4X1::OR8H3::OR6C75::OR2A25::LHB::CXCL9::MLN::NPY2R::NTS::OPRM1::TAS2R10::GNG13::PPBP::PPP2CA::PPP2R1A::NPY4R::PRKACG::PRKCE::SUCNR1::NMUR2::PTAFR::RBP2::RGR::CXCL6::TTR::DAGLA::WNT2::OR4K1::REEP4::OR4C15::OR2G2::RTP3::PROK1::CASR::GALR3::UCN2::GNA14::ARHGEF11"
"999","R-HSA-445095","0.6387","0.6403","2","31","1","Interaction between L1 and Ankyrins","SCN5A::SCN7A"
"1000","R-HSA-4641262","0.6387","0.6403","2","31","1","Disassembly of the destruction complex and recruitment of AXIN to the membrane","PPP2CA::PPP2R1A"
"1001","R-HSA-2022928","0.6387","0.6403","2","31","1","HS-GAG biosynthesis","SLC35D2::HS3ST3B1"
"1002","R-HSA-5339562","0.6387","0.6403","2","31","1","Uptake and actions of bacterial toxins","FURIN::SV2A"
"1003","R-HSA-2122948","0.6387","0.6403","2","31","1","Activated NOTCH1 Transmits Signal to the Nucleus","UBB::NUMB"
"1004","R-HSA-5654687","0.6387","0.6403","2","31","1","Downstream signaling of activated FGFR1","GRB2::FGF17"
"1005","R-HSA-196807","0.6387","0.6403","2","31","1","Nicotinate metabolism","PARP16::NADK"
"1006","R-HSA-917729","0.6387","0.6403","2","31","1","Endosomal Sorting Complex Required For Transport (ESCRT)","CHMP2A::UBB"
"1007","R-HSA-73728","0.6387","0.6403","2","31","1","RNA Polymerase I Promoter Opening","H2AC18::H3C12"
"1008","R-HSA-438064","0.6402","0.5384","5","79","1","Post NMDA receptor activation events","TUBA1B::TUBA3E::GRIN2A::PRKAA1::PRKACG"
"1009","R-HSA-674695","0.6402","0.5384","5","79","1","RNA Polymerase II Pre-transcription Events","POLR2I::POLR2L::EAF2::EAF1::CCNK"
"1010","R-HSA-112314","0.6453","0.4653","13","203","1","Neurotransmitter receptors and postsynaptic signal transmission","TUBA1B::TUBA3E::HTR3D::ARHGEF9::GRIP1::GNG5::GNG7::GRIN2A::GNG13::PRKAA1::PRKACG::CASK::PPM1F"
"1011","R-HSA-425407","0.6475","0.4522","16","249","1","SLC-mediated transmembrane transport","SLC35D2::SLC7A9::SLC29A4::SLC35D1::SLC27A6::SLC38A2::SLC4A1::SLC6A9::SLC6A13::SLC18A1::SLC30A1::SLC35B4::SLC45A3::SLC4A4::SLC16A3::SLC6A5"
"1012","R-HSA-211897","0.6496","0.5487","4","64","1","Cytochrome P450 - arranged by substrate type","CYP1B1::CYP2F1::CYP4F3::CYP3A43"
"1013","R-HSA-380270","0.6513","0.5261","5","80","1","Recruitment of mitotic centrosome proteins and complexes","DYNC1I2::PPP2R1A::HAUS7::CEP78::CEP135"
"1014","R-HSA-380287","0.6513","0.5261","5","80","1","Centrosome maturation","DYNC1I2::PPP2R1A::HAUS7::CEP78::CEP135"
"1015","R-HSA-193704","0.654","0.5077","6","96","1","p75 NTR receptor-mediated signalling","ARHGEF9::ARHGEF12::ARHGEF16::UBB::LINGO1::ARHGEF11"
"1016","R-HSA-352230","0.656","0.6211","2","32","1","Amino acid transport across the plasma membrane","SLC7A9::SLC38A2"
"1017","R-HSA-2871796","0.656","0.6211","2","32","1","FCERI mediated MAPK activation","FOS::GRB2"
"1018","R-HSA-2173796","0.656","0.6211","2","32","1","SMAD2 SMAD3-SMAD4 heterotrimer regulates transcription","UBB::CCNK"
"1019","R-HSA-3214842","0.656","0.6211","2","32","1","HDMs demethylate histones","PHF8::H3C12"
"1020","R-HSA-69190","0.656","0.6211","2","32","1","DNA strand elongation","POLA2::MCM2"
"1021","R-HSA-1251985","0.656","0.6211","2","32","1","Nuclear signaling by ERBB4","NRG4::TAB2"
"1022","R-HSA-1592389","0.656","0.6211","2","32","1","Activation of Matrix Metalloproteinases","CTRB1::FURIN"
"1023","R-HSA-167238","0.656","0.6211","2","32","1","Pausing and recovery of Tat-mediated HIV elongation","POLR2I::POLR2L"
"1024","R-HSA-167243","0.656","0.6211","2","32","1","Tat-mediated HIV elongation arrest and recovery","POLR2I::POLR2L"
"1025","R-HSA-389958","0.656","0.6211","2","32","1","Cooperation of Prefoldin and TriC CCT  in actin and tubulin folding","TUBA1B::TUBA3E"
"1026","R-HSA-110330","0.656","0.6211","2","32","1","Recognition and association of DNA glycosylase with site containing an affected purine","ACD::H2AC18"
"1027","R-HSA-110331","0.656","0.6211","2","32","1","Cleavage of the damaged purine","ACD::H2AC18"
"1028","R-HSA-73927","0.656","0.6211","2","32","1","Depurination","ACD::H2AC18"
"1029","R-HSA-2214320","0.6565","0.7242","1","15","1","Anchoring fibril formation","TLL2"
"1030","R-HSA-5637810","0.6565","0.7242","1","15","1","Constitutive Signaling by EGFRvIII","GRB2"
"1031","R-HSA-5637812","0.6565","0.7242","1","15","1","Signaling by EGFRvIII in Cancer","GRB2"
"1032","R-HSA-354194","0.6565","0.7242","1","15","1","GRB2-SOS provides linkage to MAPK signaling for Integrins ","GRB2"
"1033","R-HSA-372708","0.6565","0.7242","1","15","1","p130Cas linkage to MAPK signaling for integrins","CRK"
"1034","R-HSA-4655427","0.6565","0.7242","1","15","1","SUMOylation of DNA methylation proteins","DNMT3B"
"1035","R-HSA-2691230","0.6565","0.7242","1","15","1","Signaling by NOTCH1 HD Domain Mutants in Cancer","UBB"
"1036","R-HSA-2691232","0.6565","0.7242","1","15","1","Constitutive Signaling by NOTCH1 HD Domain Mutants","UBB"
"1037","R-HSA-5684264","0.6565","0.7242","1","15","1","MAP3K8 (TPL2)-dependent MAPK1 3 activation","UBB"
"1038","R-HSA-6785631","0.6565","0.7242","1","15","1","ERBB2 Regulates Cell Motility","NRG4"
"1039","R-HSA-8956320","0.6565","0.7242","1","15","1","Nucleobase biosynthesis","ADSS2"
"1040","R-HSA-391903","0.6565","0.7242","1","15","1","Eicosanoid ligand-binding receptors","LTB4R"
"1041","R-HSA-5358508","0.6565","0.7242","1","15","1","Mismatch Repair","EXO1"
"1042","R-HSA-69183","0.6565","0.7242","1","15","1","Processive synthesis on the lagging strand","POLA2"
"1043","R-HSA-5654228","0.6565","0.7242","1","15","1","Phospholipase C-mediated cascade; FGFR4","FGF17"
"1044","R-HSA-71336","0.6565","0.7242","1","15","1","Pentose phosphate pathway","PRPS1L1"
"1045","R-HSA-1474165","0.6572","0.4921","7","112","1","Reproduction","KCNU1::MSH5::CATSPERG::ACD::SYCP1::H2AC18::H3C12"
"1046","R-HSA-5619115","0.6573","0.4618","11","174","1","Disorders of transmembrane transporters","SLC7A9::GCKR::NUP88::NUP133::PSMD4::SLC4A1::UBB::SLC4A4::DERL3::SLC6A5::NUP58"
"1047","R-HSA-1500931","0.6608","0.4785","8","128","1","Cell-Cell communication","CDH6::CTNNA1::GRB2::CLDN11::PARD6A::PARD3::RSU1::CASK"
"1048","R-HSA-114608","0.6608","0.4785","8","128","1","Platelet degranulation ","SCG3::CYB5R1::PPBP::SRGN::RAB27B::TGFB3::MANF::PHACTR2"
"1049","R-HSA-162909","0.6608","0.4785","8","128","1","Host Interactions of HIV factors","PSIP1::AP1S3::NUP88::NUP133::PSMD4::UBB::CD4::NUP58"
"1050","R-HSA-6809371","0.6608","0.4785","8","128","1","Formation of the cornified envelope","LCE2B::LCE3B::KRT15::FURIN::PKP2::PPL::PERP::SPINK9"
"1051","R-HSA-6782135","0.6617","0.5351","4","65","1","Dual incision in TC-NER","ERCC4::POLR2I::POLR2L::UBB"
"1052","R-HSA-195253","0.6621","0.5139","5","81","1","Degradation of beta-catenin by the destruction complex","PPP2CA::PPP2R1A::PSMD4::TLE4::UBB"
"1053","R-HSA-9013694","0.6621","0.5139","5","81","1","Signaling by NOTCH4","HEY1::NOTCH4::PSMD4::UBB::YWHAZ"
"1054","R-HSA-177929","0.664","0.5626","3","49","1","Signaling by EGFR","GRB2::SH3KBP1::UBB"
"1055","R-HSA-6791312","0.664","0.5626","3","49","1","TP53 Regulates Transcription of Cell Cycle Genes","PLK3::CNOT1::CNOT11"
"1056","R-HSA-5684996","0.6725","0.4249","16","253","1","MAPK1 MAPK3 signaling","RANBP9::CSF2RB::NRG4::RASA3::GRB2::JAK1::SPRED3::MARK3::PDGFRA::PPP2CA::PPP2R1A::PPP5C::PSMD4::TEK::UBB::FGF17"
"1057","R-HSA-418990","0.6726","0.6021","2","33","1","Adherens junctions interactions","CDH6::CTNNA1"
"1058","R-HSA-2871809","0.6726","0.6021","2","33","1","FCERI mediated Ca+2 mobilization","GRB2::NFATC1"
"1059","R-HSA-5693568","0.6726","0.6021","2","33","1","Resolution of D-loop Structures through Holliday Junction Intermediates","RAD51B::EXO1"
"1060","R-HSA-4085001","0.6726","0.6021","2","33","1","Sialic acid metabolism","ST8SIA6::ST3GAL1"
"1061","R-HSA-113418","0.6726","0.6021","2","33","1","Formation of the Early Elongation Complex","POLR2I::POLR2L"
"1062","R-HSA-167158","0.6726","0.6021","2","33","1","Formation of the HIV-1 Early Elongation Complex","POLR2I::POLR2L"
"1063","R-HSA-174154","0.6735","0.5216","4","66","1","APC C-Cdc20 mediated degradation of Securin","CDC26::ANAPC11::PSMD4::UBB"
"1064","R-HSA-4420097","0.6736","0.4855","6","98","1","VEGFA-VEGFR2 Pathway","WASF3::CRK::CTNNA1::PRKACG::MAPK11::WASF1"
"1065","R-HSA-5607764","0.6736","0.4855","6","98","1","CLEC7A (Dectin-1) signaling","TAB2::NFATC1::NFKB2::PSMD4::RELB::UBB"
"1066","R-HSA-15869","0.6736","0.4855","6","98","1","Metabolism of nucleotides","ADSS2::NT5C2::SAMHD1::HPRT1::ENTPD8::CTPS2"
"1067","R-HSA-69275","0.6759","0.4362","12","192","1","G2 M Transition","TUBA1B::TUBA3E::DYNC1I2::PHLDA1::FOXM1::PPP2CA::PPP2R1A::HAUS7::PSMD4::UBB::CEP78::CEP135"
"1068","R-HSA-5620920","0.6774","0.547","3","50","1","Cargo trafficking to the periciliary membrane","PKD1::EXOC4::BBIP1"
"1069","R-HSA-1660516","0.6801","0.6981","1","16","1","Synthesis of PIPs at the early endosome membrane","MTMR4"
"1070","R-HSA-1433559","0.6801","0.6981","1","16","1","Regulation of KIT signaling","GRB2"
"1071","R-HSA-2730905","0.6801","0.6981","1","16","1","Role of LAT2 NTAL LAB on calcium mobilization","GRB2"
"1072","R-HSA-418457","0.6801","0.6981","1","16","1","cGMP effects","KCNMA1"
"1073","R-HSA-156711","0.6801","0.6981","1","16","1","Polo-like kinase mediated events","FOXM1"
"1074","R-HSA-204174","0.6801","0.6981","1","16","1","Regulation of pyruvate dehydrogenase (PDH) complex","PDHB"
"1075","R-HSA-391160","0.6801","0.6981","1","16","1","Signal regulatory protein family interactions","GRB2"
"1076","R-HSA-3322077","0.6801","0.6981","1","16","1","Glycogen synthesis","UBB"
"1077","R-HSA-193639","0.6801","0.6981","1","16","1","p75NTR signals via NF-kB","UBB"
"1078","R-HSA-3229121","0.6801","0.6981","1","16","1","Glycogen storage diseases","UBB"
"1079","R-HSA-205043","0.6801","0.6981","1","16","1","NRIF signals cell death from the nucleus","UBB"
"1080","R-HSA-190242","0.6801","0.6981","1","16","1","FGFR1 ligand binding and activation","FGF17"
"1081","R-HSA-5654219","0.6801","0.6981","1","16","1","Phospholipase C-mediated cascade- FGFR1","FGF17"
"1082","R-HSA-110312","0.6801","0.6981","1","16","1","Translesion synthesis by REV1","UBB"
"1083","R-HSA-2559584","0.6801","0.6981","1","16","1","Formation of Senescence-Associated Heterochromatin Foci (SAHF)","H1-2"
"1084","R-HSA-5685942","0.6851","0.5082","4","67","1","HDR through Homologous Recombination (HRR)","CHEK1::RAD51B::UBB::EXO1"
"1085","R-HSA-68867","0.6851","0.5082","4","67","1","Assembly of the pre-replicative complex","MCM2::PSMD4::UBB::CDC6"
"1086","R-HSA-5658442","0.6851","0.5082","4","67","1","Regulation of RAS by GAPs","RASA3::SPRED3::PSMD4::UBB"
"1087","R-HSA-4791275","0.6886","0.5832","2","34","1","Signaling by WNT in cancer","PPP2CA::PPP2R1A"
"1088","R-HSA-5693537","0.6886","0.5832","2","34","1","Resolution of D-Loop Structures","RAD51B::EXO1"
"1089","R-HSA-9615710","0.6886","0.5832","2","34","1","Microautophagy","CHMP2A::UBB"
"1090","R-HSA-196071","0.6886","0.5832","2","34","1","Metabolism of steroid hormones","AKR1B1::LHB"
"1091","R-HSA-453274","0.6896","0.4209","12","194","1","Mitotic G2-G2 M phases","TUBA1B::TUBA3E::DYNC1I2::PHLDA1::FOXM1::PPP2CA::PPP2R1A::HAUS7::PSMD4::UBB::CEP78::CEP135"
"1092","R-HSA-8866654","0.6905","0.5316","3","51","1","E3 ubiquitin ligases ubiquitinate target proteins","PEX2::HLTF::UBB"
"1093","R-HSA-180534","0.6905","0.5316","3","51","1","Vpu mediated degradation of CD4","PSMD4::UBB::CD4"
"1094","R-HSA-69601","0.6905","0.5316","3","51","1","Ubiquitin Mediated Degradation of Phosphorylated Cdc25A","CHEK1::PSMD4::UBB"
"1095","R-HSA-69610","0.6905","0.5316","3","51","1","p53-Independent DNA Damage Response","CHEK1::PSMD4::UBB"
"1096","R-HSA-69613","0.6905","0.5316","3","51","1","p53-Independent G1 S DNA damage checkpoint","CHEK1::PSMD4::UBB"
"1097","R-HSA-9020702","0.6926","0.4637","6","100","1","Interleukin-1 signaling","TAB2::NKIRAS2::NFKB2::PSMD4::PELI2::UBB"
"1098","R-HSA-5632684","0.6934","0.4779","5","84","1","Hedgehog 'on' state","GAS1::GLI1::PSMD4::UBB::NUMB"
"1099","R-HSA-69002","0.6934","0.4779","5","84","1","DNA Replication Pre-Initiation","POLA2::MCM2::PSMD4::UBB::CDC6"
"1100","R-HSA-162906","0.696","0.4055","14","226","1","HIV Infection","PSIP1::AP1S3::NEDD4L::CHMP2A::NUP88::FURIN::POLR2I::POLR2L::NUP133::PSMD4::UBB::CCNK::CD4::NUP58"
"1101","R-HSA-8948751","0.6963","0.4949","4","68","1","Regulation of PTEN stability and activity","OTUD3::PSMD4::UBB::RNF146"
"1102","R-HSA-73884","0.6963","0.4949","4","68","1","Base Excision Repair","SMUG1::ACD::H2AC18::MBD4"
"1103","R-HSA-164378","0.7022","0.6721","1","17","1","PKA activation in glucagon signalling","PRKACG"
"1104","R-HSA-180292","0.7022","0.6721","1","17","1","GAB1 signalosome","GRB2"
"1105","R-HSA-416993","0.7022","0.6721","1","17","1","Trafficking of GluR2-containing AMPA receptors","GRIP1"
"1106","R-HSA-435354","0.7022","0.6721","1","17","1","Zinc transporters","SLC30A1"
"1107","R-HSA-202131","0.7022","0.6721","1","17","1","Metabolism of nitric oxide- eNOS activation and regulation","NOSIP"
"1108","R-HSA-8963889","0.7022","0.6721","1","17","1","Assembly of active LPL and LIPC lipase complexes","FURIN"
"1109","R-HSA-5656121","0.7022","0.6721","1","17","1","Translesion synthesis by POLI","UBB"
"1110","R-HSA-5676594","0.7022","0.6721","1","17","1","TNF receptor superfamily (TNFSF) members mediating non-canonical NF-kB pathway","TNFRSF13C"
"1111","R-HSA-5655862","0.7022","0.6721","1","17","1","Translesion synthesis by POLK","UBB"
"1112","R-HSA-2033519","0.7022","0.6721","1","17","1","Activated point mutants of FGFR2","FGF17"
"1113","R-HSA-74259","0.7022","0.6721","1","17","1","Purine catabolism","NT5C2"
"1114","R-HSA-76005","0.7023","0.4313","8","133","1","Response to elevated platelet cytosolic Ca2+","SCG3::CYB5R1::PPBP::SRGN::RAB27B::TGFB3::MANF::PHACTR2"
"1115","R-HSA-8953897","0.7024","0.3678","29","457","1","Cellular responses to external stimuli","RRAGB::CITED2::TUBA1B::DCTN6::TUBA3E::DYNC1I2::FLCN::FKBP4::TNRC6B::FOS::CDC26::GPX6::H1-2::NUDT2::LAMTOR4::NUP88::ANAPC11::NUP133::ACTR10::MAPK11::PSMD4::TNRC6C::ACD::UBB::NOX5::H2AC18::H3C12::MT4::NUP58"
"1116","R-HSA-2980766","0.7032","0.5163","3","52","1","Nuclear Envelope Breakdown","NUP88::NUP133::NUP58"
"1117","R-HSA-2029480","0.7033","0.4661","5","85","1","Fcgamma receptor (FCGR) dependent phagocytosis","WASF3::CRK::GRB2::PRKCE::WASF1"
"1118","R-HSA-174143","0.7033","0.4661","5","85","1","APC C-mediated degradation of cell cycle proteins","CDC26::ANAPC11::PSMD4::UBB::CDC14A"
"1119","R-HSA-453276","0.7033","0.4661","5","85","1","Regulation of mitotic cell cycle","CDC26::ANAPC11::PSMD4::UBB::CDC14A"
"1120","R-HSA-432720","0.704","0.5645","2","35","1","Lysosome Vesicle Biogenesis","AP1S3::CHMP2A"
"1121","R-HSA-5625886","0.704","0.5645","2","35","1","Activated PKN1 stimulates transcription of AR (androgen receptor) regulated genes KLK2 and KLK3","H2AC18::H3C12"
"1122","R-HSA-2262752","0.7078","0.3631","28","443","1","Cellular responses to stress","RRAGB::CITED2::TUBA1B::DCTN6::TUBA3E::DYNC1I2::FLCN::FKBP4::TNRC6B::FOS::CDC26::GPX6::H1-2::NUDT2::LAMTOR4::NUP88::ANAPC11::NUP133::ACTR10::MAPK11::PSMD4::TNRC6C::ACD::UBB::NOX5::H2AC18::H3C12::NUP58"
"1123","R-HSA-69239","0.71","0.4317","7","118","1","Synthesis of DNA","POLA2::CDC26::MCM2::ANAPC11::PSMD4::UBB::CDC6"
"1124","R-HSA-1500620","0.7131","0.4545","5","86","1","Meiosis","MSH5::ACD::SYCP1::H2AC18::H3C12"
"1125","R-HSA-6781823","0.7154","0.5012","3","53","1","Formation of TC-NER Pre-Incision Complex","POLR2I::POLR2L::UBB"
"1126","R-HSA-5617833","0.7161","0.3908","12","198","1","Cilium Assembly","TUBA1B::TUBA3E::DYNC1I2::DYNC2LI1::PKD1::PPP2R1A::HAUS7::EXOC4::DYNLRB1::CEP78::BBIP1::CEP135"
"1127","R-HSA-68949","0.7179","0.4687","4","70","1","Orc1 removal from chromatin","MCM2::PSMD4::UBB::CDC6"
"1128","R-HSA-5689896","0.7187","0.5461","2","36","1","Ovarian tumor domain proteases","OTUD3::UBB"
"1129","R-HSA-390522","0.7187","0.5461","2","36","1","Striated Muscle Contraction","ACTA1::TNNT3"
"1130","R-HSA-427359","0.7187","0.5461","2","36","1","SIRT1 negatively regulates rRNA expression","H2AC18::H3C12"
"1131","R-HSA-5635838","0.7227","0.6463","1","18","1","Activation of SMO","GAS1"
"1132","R-HSA-1369062","0.7227","0.6463","1","18","1","ABC transporters in lipid homeostasis","ABCG1"
"1133","R-HSA-181430","0.7227","0.6463","1","18","1","Norepinephrine Neurotransmitter Release Cycle","CPLX1"
"1134","R-HSA-446353","0.7227","0.6463","1","18","1","Cell-extracellular matrix interactions","RSU1"
"1135","R-HSA-881907","0.7227","0.6463","1","18","1","Gastrin-CREB signalling pathway via PKC and MAPK","GRB2"
"1136","R-HSA-111471","0.7227","0.6463","1","18","1","Apoptotic factor-mediated response","C1QBP"
"1137","R-HSA-8963898","0.7227","0.6463","1","18","1","Plasma lipoprotein assembly","PRKACG"
"1138","R-HSA-5654221","0.7227","0.6463","1","18","1","Phospholipase C-mediated cascade; FGFR2","FGF17"
"1139","R-HSA-163210","0.7227","0.6463","1","18","1","Formation of ATP by chemiosmotic coupling","ATP5F1A"
"1140","R-HSA-1266738","0.7249","0.3204","68","1051","1","Developmental Biology","RANBP9::CDK5::TUBA1B::DPYSL4::RNPS1::TUBA3E::CTNNA1::DAG1::DCX::EGR2::EPHB6::ABLIM3::NCOA6::FOXO3::FLI1::ARHGEF12::RPL13A::NR5A2::RPL36::LCE2B::GRB2::SH3KBP1::FOXA2::HNF4G::HOXB4::LCE3B::INSM1::KRT15::KRTAP26-1::LAMB1::NKX6-1::FURIN::MED15::PKNOX1::PKP2::POLR2I::POLR2L::PPL::DPPA4::PRKACG::MAPK11::RELN::LHX9::PSMD4::PTPRC::RARA::NTN4::RPS5::RPS21::SCN5A::SCN7A::PERP::SPINK9::TBL1X::UBB::MYH14::H2AC18::H3C12::KRTAP9-2::ABLIM2::NUMB::LDB1::MED23::MED20::TGS1::EIF4A3::ARHGEF11::MAFB"
"1141","R-HSA-9639288","0.7273","0.4863","3","54","1","Amino acids regulate mTORC1","RRAGB::FLCN::LAMTOR4"
"1142","R-HSA-5620924","0.7273","0.4863","3","54","1","Intraflagellar transport","TUBA1B::DYNC2LI1::DYNLRB1"
"1143","R-HSA-4641257","0.7273","0.4863","3","54","1","Degradation of AXIN","PSMD4::UBB::RNF146"
"1144","R-HSA-912446","0.7273","0.4863","3","54","1","Meiotic recombination","MSH5::H2AC18::H3C12"
"1145","R-HSA-211945","0.7282","0.4214","6","104","1","Phase I - Functionalization of compounds","ADH1B::CYP1B1::CYP2F1::CYP4F3::PTGS1::CYP3A43"
"1146","R-HSA-174184","0.7283","0.4559","4","71","1","Cdc20-Phospho-APC C mediated degradation of Cyclin A","CDC26::ANAPC11::PSMD4::UBB"
"1147","R-HSA-174178","0.7283","0.4559","4","71","1","APC C-Cdh1 mediated degradation of Cdc20 and other APC C-Cdh1 targeted proteins in late mitosis early G1","CDC26::ANAPC11::PSMD4::UBB"
"1148","R-HSA-76009","0.7328","0.5279","2","37","1","Platelet Aggregation (Plug Formation)","CRK::GRB2"
"1149","R-HSA-5685938","0.7328","0.5279","2","37","1","HDR through Single Strand Annealing (SSA)","ERCC4::EXO1"
"1150","R-HSA-8979227","0.7328","0.5279","2","37","1","Triglyceride metabolism","ABHD5::PRKACG"
"1151","R-HSA-179419","0.7384","0.4432","4","72","1","APC-Cdc20 mediated degradation of cell cycle proteins prior to satisfation of the cell cycle checkpoint","CDC26::ANAPC11::PSMD4::UBB"
"1152","R-HSA-1638091","0.7388","0.4716","3","55","1","Heparan sulfate heparin (HS-GAG) metabolism","SLC35D2::XYLT2::HS3ST3B1"
"1153","R-HSA-977443","0.7388","0.4716","3","55","1","GABA receptor activation","ARHGEF9::GNG5::GNG7"
"1154","R-HSA-1221632","0.7388","0.4716","3","55","1","Meiotic synapsis","ACD::SYCP1::H2AC18"
"1155","R-HSA-73887","0.7404","0.3862","8","138","1","Death Receptor Signalling","TAB2::ARHGEF9::ARHGEF12::ARHGEF16::UBB::LINGO1::TNFSF10::ARHGEF11"
"1156","R-HSA-9607240","0.7413","0.3475","16","265","1","FLT3 Signaling","RANBP9::CSF2RB::NRG4::RASA3::GRB2::JAK1::SPRED3::MARK3::PDGFRA::PPP2CA::PPP2R1A::PPP5C::PSMD4::TEK::UBB::FGF17"
"1157","R-HSA-3928664","0.7417","0.621","1","19","1","Ephrin signaling","EPHB6"
"1158","R-HSA-163615","0.7417","0.621","1","19","1","PKA activation","PRKACG"
"1159","R-HSA-197264","0.7417","0.621","1","19","1","Nicotinamide salvaging","PARP16"
"1160","R-HSA-416700","0.7417","0.621","1","19","1","Other semaphorin interactions","PTPRC"
"1161","R-HSA-8964038","0.7417","0.621","1","19","1","LDL clearance","PCSK9"
"1162","R-HSA-622312","0.7417","0.621","1","19","1","Inflammasomes","NFKB2"
"1163","R-HSA-1362277","0.7417","0.621","1","19","1","Transcription of E2F targets under negative control by DREAM complex","CDC6"
"1164","R-HSA-6804760","0.7417","0.621","1","19","1","Regulation of TP53 Activity through Methylation","UBB"
"1165","R-HSA-3000480","0.7417","0.621","1","19","1","Scavenging by Class A Receptors","MARCO"
"1166","R-HSA-8876725","0.7417","0.621","1","19","1","Protein methylation","METTL21A"
"1167","R-HSA-110320","0.7417","0.621","1","19","1","Translesion Synthesis by POLH","UBB"
"1168","R-HSA-5686938","0.7417","0.621","1","19","1","Regulation of TLR by endogenous ligand","CD14"
"1169","R-HSA-422085","0.7417","0.621","1","19","1","Synthesis, secretion, and deacylation of Ghrelin","SEC11A"
"1170","R-HSA-194138","0.7449","0.4009","6","106","1","Signaling by VEGF","WASF3::CRK::CTNNA1::PRKACG::MAPK11::WASF1"
"1171","R-HSA-2129379","0.7462","0.5099","2","38","1","Molecules associated with elastic fibres","FBN1::TGFB3"
"1172","R-HSA-8950505","0.7462","0.5099","2","38","1","Gene and protein expression by JAK-STAT signaling after Interleukin-12 stimulation","HNRNPF::MTAP"
"1173","R-HSA-5663205","0.7467","0.3265","23","375","1","Infectious disease","PSIP1::AP1S3::NEDD4L::RPL13A::RPL36::CHMP2A::GRB2::SH3KBP1::NUP88::FURIN::POLR2I::POLR2L::NUP133::PSMD4::RPS5::RPS21::UBB::CBLL1::CANX::CCNK::CD4::NUP58::SV2A"
"1174","R-HSA-72187","0.7499","0.4572","3","56","1","mRNA 3'-end processing","RNPS1::U2AF1::EIF4A3"
"1175","R-HSA-2559586","0.7499","0.4572","3","56","1","DNA Damage Telomere Stress Induced Senescence","H1-2::ACD::H2AC18"
"1176","R-HSA-72306","0.753","0.3909","6","107","1","tRNA processing","ZBTB8OS::NUP88::PUS7::NUP133::THADA::NUP58"
"1177","R-HSA-422475","0.7539","0.3057","34","546","1","Axon guidance","RANBP9::CDK5::TUBA1B::DPYSL4::RNPS1::TUBA3E::DAG1::DCX::EPHB6::ABLIM3::ARHGEF12::RPL13A::RPL36::GRB2::SH3KBP1::LAMB1::PRKACG::MAPK11::RELN::LHX9::PSMD4::PTPRC::NTN4::RPS5::RPS21::SCN5A::SCN7A::UBB::MYH14::ABLIM2::NUMB::LDB1::EIF4A3::ARHGEF11"
"1178","R-HSA-5250913","0.7577","0.4184","4","74","1","Positive epigenetic regulation of rRNA expression","POLR2L::H2AC18::H3C12::MTA2"
"1179","R-HSA-176409","0.7577","0.4184","4","74","1","APC C-Cdc20 mediated degradation of mitotic proteins","CDC26::ANAPC11::PSMD4::UBB"
"1180","R-HSA-4086400","0.7584","0.3983","5","91","1","PCP CE pathway","DAAM1::PARD6A::PSMD4::VANGL2::UBB"
"1181","R-HSA-977444","0.7591","0.4923","2","39","1","GABA B receptor activation","GNG5::GNG7"
"1182","R-HSA-991365","0.7591","0.4923","2","39","1","Activation of GABAB receptors","GNG5::GNG7"
"1183","R-HSA-73933","0.7591","0.4923","2","39","1","Resolution of Abasic Sites (AP sites)","SMUG1::MBD4"
